{
  "artifactId": "synthetic-player-truth",
  "artifactType": "player-truth",
  "artifactVersion": "synthetic-pt-v1",
  "effectiveAt": "2026-08-31T22:00:00Z",
  "expiresAt": "2026-09-03T12:00:00Z",
  "generatedAt": "2026-08-31T22:00:00Z",
  "integrity": {
    "canonicalization": "draft-command-canonical-json-v1",
    "payloadSha256": "4f5734ff1845e22b829f68a82ef334f41c561a7bb19162964e0c8d5b5864a762"
  },
  "players": [
    {
      "availabilityConfidence": 0.98,
      "availabilityStatus": "available",
      "bustProbability": 0.11,
      "canonicalPlayerKey": "synthetic.player.01",
      "draftCommandBoardRank": 1,
      "eligibleFeatureFamilies": [
        "consensus-projection",
        "football-fundamentals"
      ],
      "eliteProbability": 0.35,
      "espnPlayerId": "900001",
      "expectedGames": 16,
      "fullPprPointsP10": 242.1,
      "fullPprPointsP50": 329.52,
      "fullPprPointsP90": 416.95,
      "identityConfidence": 0.99,
      "identityMatchMethod": "espn-id",
      "internalPlayerId": 1001,
      "limitations": [
        "Synthetic fixture; not a player valuation."
      ],
      "modelConfidence": 0.934,
      "nflTeam": "AAA",
      "normalizedName": "Synthetic Player 01",
      "position": "QB",
      "projectedFullPprPoints": 336.25,
      "projectedPpg": 21.0156,
      "provenance": {
        "modelVersion": "synthetic-player-truth-model-v1",
        "sourceArtifactIds": [
          "synthetic-consensus",
          "synthetic-fundamentals"
        ]
      },
      "quarantinedFeatureFamilies": [],
      "starterProbability": 0.875
    },
    {
      "availabilityConfidence": 0.98,
      "availabilityStatus": "available",
      "bustProbability": 0.12,
      "canonicalPlayerKey": "synthetic.player.02",
      "draftCommandBoardRank": 2,
      "eligibleFeatureFamilies": [
        "consensus-projection",
        "football-fundamentals"
      ],
      "eliteProbability": 0.34,
      "espnPlayerId": "900002",
      "expectedGames": 16,
      "fullPprPointsP10": 237.96,
      "fullPprPointsP50": 323.89,
      "fullPprPointsP90": 409.82,
      "identityConfidence": 0.99,
      "identityMatchMethod": "espn-id",
      "internalPlayerId": 1002,
      "limitations": [
        "Synthetic fixture; not a player valuation."
      ],
      "modelConfidence": 0.928,
      "nflTeam": "BBB",
      "normalizedName": "Synthetic Player 02",
      "position": "RB",
      "projectedFullPprPoints": 330.5,
      "projectedPpg": 20.6562,
      "provenance": {
        "modelVersion": "synthetic-player-truth-model-v1",
        "sourceArtifactIds": [
          "synthetic-consensus",
          "synthetic-fundamentals"
        ]
      },
      "quarantinedFeatureFamilies": [],
      "starterProbability": 0.86
    },
    {
      "availabilityConfidence": 0.98,
      "availabilityStatus": "available",
      "bustProbability": 0.13,
      "canonicalPlayerKey": "synthetic.player.03",
      "draftCommandBoardRank": 3,
      "eligibleFeatureFamilies": [
        "consensus-projection",
        "football-fundamentals"
      ],
      "eliteProbability": 0.33,
      "espnPlayerId": "900003",
      "expectedGames": 16,
      "fullPprPointsP10": 233.82,
      "fullPprPointsP50": 318.25,
      "fullPprPointsP90": 402.69,
      "identityConfidence": 0.99,
      "identityMatchMethod": "espn-id",
      "internalPlayerId": 1003,
      "limitations": [
        "Synthetic fixture; not a player valuation."
      ],
      "modelConfidence": 0.922,
      "nflTeam": "CCC",
      "normalizedName": "Synthetic Player 03",
      "position": "WR",
      "projectedFullPprPoints": 324.75,
      "projectedPpg": 20.2969,
      "provenance": {
        "modelVersion": "synthetic-player-truth-model-v1",
        "sourceArtifactIds": [
          "synthetic-consensus",
          "synthetic-fundamentals"
        ]
      },
      "quarantinedFeatureFamilies": [],
      "starterProbability": 0.845
    },
    {
      "availabilityConfidence": 0.98,
      "availabilityStatus": "available",
      "bustProbability": 0.14,
      "canonicalPlayerKey": "synthetic.player.04",
      "draftCommandBoardRank": 4,
      "eligibleFeatureFamilies": [
        "consensus-projection",
        "football-fundamentals"
      ],
      "eliteProbability": 0.32,
      "espnPlayerId": "900004",
      "expectedGames": 16,
      "fullPprPointsP10": 229.68,
      "fullPprPointsP50": 312.62,
      "fullPprPointsP90": 395.56,
      "identityConfidence": 0.99,
      "identityMatchMethod": "espn-id",
      "internalPlayerId": 1004,
      "limitations": [
        "Synthetic fixture; not a player valuation."
      ],
      "modelConfidence": 0.916,
      "nflTeam": "DDD",
      "normalizedName": "Synthetic Player 04",
      "position": "TE",
      "projectedFullPprPoints": 319.0,
      "projectedPpg": 19.9375,
      "provenance": {
        "modelVersion": "synthetic-player-truth-model-v1",
        "sourceArtifactIds": [
          "synthetic-consensus",
          "synthetic-fundamentals"
        ]
      },
      "quarantinedFeatureFamilies": [],
      "starterProbability": 0.83
    },
    {
      "availabilityConfidence": 0.98,
      "availabilityStatus": "available",
      "bustProbability": 0.15,
      "canonicalPlayerKey": "synthetic.player.05",
      "draftCommandBoardRank": 5,
      "eligibleFeatureFamilies": [
        "consensus-projection",
        "football-fundamentals"
      ],
      "eliteProbability": 0.31,
      "espnPlayerId": "900005",
      "expectedGames": 16,
      "fullPprPointsP10": 225.54,
      "fullPprPointsP50": 306.99,
      "fullPprPointsP90": 388.43,
      "identityConfidence": 0.99,
      "identityMatchMethod": "espn-id",
      "internalPlayerId": 1005,
      "limitations": [
        "Synthetic fixture; not a player valuation."
      ],
      "modelConfidence": 0.91,
      "nflTeam": "EEE",
      "normalizedName": "Synthetic Player 05",
      "position": "QB",
      "projectedFullPprPoints": 313.25,
      "projectedPpg": 19.5781,
      "provenance": {
        "modelVersion": "synthetic-player-truth-model-v1",
        "sourceArtifactIds": [
          "synthetic-consensus",
          "synthetic-fundamentals"
        ]
      },
      "quarantinedFeatureFamilies": [],
      "starterProbability": 0.815
    },
    {
      "availabilityConfidence": 0.98,
      "availabilityStatus": "available",
      "canonicalPlayerKey": "synthetic.player.06",
      "draftCommandBoardRank": 6,
      "eligibleFeatureFamilies": [
        "consensus-projection",
        "football-fundamentals"
      ],
      "espnPlayerId": "900006",
      "expectedGames": 16,
      "identityConfidence": 0.99,
      "identityMatchMethod": "espn-id",
      "internalPlayerId": 1006,
      "limitations": [
        "Synthetic fixture; not a player valuation."
      ],
      "modelConfidence": 0.904,
      "nflTeam": "FFF",
      "normalizedName": "Synthetic Player 06",
      "position": "RB",
      "projectedFullPprPoints": 307.5,
      "projectedPpg": 19.2188,
      "provenance": {
        "modelVersion": "synthetic-player-truth-model-v1",
        "sourceArtifactIds": [
          "synthetic-consensus",
          "synthetic-fundamentals"
        ]
      },
      "quarantinedFeatureFamilies": []
    },
    {
      "availabilityConfidence": 0.98,
      "availabilityStatus": "available",
      "bustProbability": 0.17,
      "canonicalPlayerKey": "synthetic.player.07",
      "draftCommandBoardRank": 7,
      "eligibleFeatureFamilies": [
        "consensus-projection",
        "football-fundamentals"
      ],
      "eliteProbability": 0.29,
      "espnPlayerId": "900007",
      "expectedGames": 16,
      "fullPprPointsP10": 217.26,
      "fullPprPointsP50": 295.71,
      "fullPprPointsP90": 374.17,
      "identityConfidence": 0.99,
      "identityMatchMethod": "espn-id",
      "internalPlayerId": 1007,
      "limitations": [
        "Synthetic fixture; not a player valuation."
      ],
      "modelConfidence": 0.898,
      "nflTeam": "AAA",
      "normalizedName": "Synthetic Player 07",
      "position": "WR",
      "projectedFullPprPoints": 301.75,
      "projectedPpg": 18.8594,
      "provenance": {
        "modelVersion": "synthetic-player-truth-model-v1",
        "sourceArtifactIds": [
          "synthetic-consensus",
          "synthetic-fundamentals"
        ]
      },
      "quarantinedFeatureFamilies": [
        "unvalidated-signal"
      ],
      "starterProbability": 0.785
    },
    {
      "availabilityConfidence": 0.98,
      "availabilityStatus": "available",
      "bustProbability": 0.18,
      "canonicalPlayerKey": "synthetic.player.08",
      "draftCommandBoardRank": 8,
      "eligibleFeatureFamilies": [
        "consensus-projection",
        "football-fundamentals"
      ],
      "eliteProbability": 0.28,
      "espnPlayerId": "900008",
      "expectedGames": 16,
      "fullPprPointsP10": 213.12,
      "fullPprPointsP50": 290.08,
      "fullPprPointsP90": 367.04,
      "identityConfidence": 0.99,
      "identityMatchMethod": "espn-id",
      "internalPlayerId": 1008,
      "limitations": [
        "Synthetic fixture; not a player valuation."
      ],
      "modelConfidence": 0.892,
      "nflTeam": "BBB",
      "normalizedName": "Synthetic Player 08",
      "position": "TE",
      "projectedFullPprPoints": 296.0,
      "projectedPpg": 18.5,
      "provenance": {
        "modelVersion": "synthetic-player-truth-model-v1",
        "sourceArtifactIds": [
          "synthetic-consensus",
          "synthetic-fundamentals"
        ]
      },
      "quarantinedFeatureFamilies": [],
      "starterProbability": 0.77
    },
    {
      "availabilityConfidence": 0.8,
      "availabilityStatus": "questionable",
      "bustProbability": 0.19,
      "canonicalPlayerKey": "synthetic.player.09",
      "draftCommandBoardRank": 9,
      "eligibleFeatureFamilies": [
        "consensus-projection",
        "football-fundamentals"
      ],
      "eliteProbability": 0.27,
      "espnPlayerId": "900009",